ID,Name,Severity,Status,Location,Branch,Message,Description,Line Span,CWE,Created Date,Closed Date,False Positive,False Positive Explanation
ecbdb16f-918f-4c0c-bbc4-d0777316edc1,Hardcoded Seed Credentials,high,open,/app/backend/src/database/seeds/users.sql,taskflow,The seed file exposes hardcoded credentials that allow an attacker to perform offline brute force attacks. Since the same password hash is reused for all users; cracking it could give an attacker access to every account; including the admin account. This critical issue violates secret management principles and should be remedied to secure the system.,The seed file contains hardcoded user credentials; including emails and password hashes; which introduces a static attack surface. If an attacker gains access to the repository; they can extract these details; notably the identical password hash reused across all accounts. This creates an avenue for offline brute force attacks where the attacker attempts to crack the password hash to compromise all seeded accounts; including an administrative user.  In addition; embedding such secrets in the code violates basic secret management practices and exposes the system to significant risks in case of repository compromise. The reuse of the same bcrypt hash exacerbates the vulnerability; as cracking it once can potentially compromise the security of all user accounts. This issue; classified under CWE-798 for hardcoded credentials; should be addressed immediately to reduce the attack surface and adhere to secure programming practices.,2@@6,CWE-798,"8/8/2025, 6:20:42 PM",,False,The hardcoded credentials in the seed file represent a true vulnerability. Given that the seed file is likely used to initialize production user data; including an administrative account; an attacker with repository access could leverage the static bcrypt hash to perform offline brute force attacks. The vulnerability violates secret management best practices CWE-798 and introduces a substantial security risk; making it a valid issue and not a false positive.
614c0f15-c3a9-4405-a025-4f1a590b2673,Log Injection Risk,medium,open,/app/backend/src/controllers/taskController.ts,taskflow,User input is logged without sanitization; enabling injection of malicious control characters. This can alter log formats and hide malicious activity. Unsanitized log entries pose a risk to forensic analysis and log integrity.,The log message concatenates values derived from user input without any sanitization; directly embedding them into the log output. This practice can allow an attacker to inject newline or control characters that could lead to log injection attacks; altering the intended log format and obscuring malicious actions. Without proper output neutralization; attackers can manipulate the log file; which can hinder forensic analysis and log integrity; making it a significant security risk.,28@@30,CWE-117,"8/8/2025, 6:19:24 PM",,False,The code logs unsanitized user inputs in a production controller; which exposes a genuine log injection vulnerability. The lack of sanitization in the log message particularly for the 'projectId' field can allow an attacker to manipulate log entries; compromising forensic accuracy and log integrity. This constitutes a valid security issue rather than a false positive.
a09f2b0c-96a4-41e1-bb42-4c4bbe455ee5,IDOR on Task Retrieval,high,open,/app/backend/src/controllers/taskController.ts,taskflow,The endpoint fails to perform an ownership check when retrieving tasks; allowing malicious users to access other users' tasks by guessing valid task IDs. Without proper session validation against the data; the issue is exploitable; exposing sensitive user data and potentially leading to broader security breaches. Remediation involves implementing robust access control to verify that the user requesting the task data is its rightful owner.,The issue arises because the endpoint retrieves tasks based solely on the task identifier without verifying that the requester owns the task. This results in an Insecure Direct Object Reference IDOR vulnerability. Without proper ownership or permission checks; an attacker who can guess or know task IDs can access sensitive task data; leading to potential data leaks and unauthorized information exposure.,48@@54,CWE-639,"8/8/2025, 6:19:24 PM",,False,The getTaskById endpoint lacks an ownership check after verifying authentication. The provided task id from user input is used directly to retrieve task details without verifying that the task belongs to the requesting user. Given that this controller is part of the production code for TaskFlow; a production task management platform; the absence of proper access control mechanisms makes the issue a true vulnerability rather than a false positive.
9d2f6aef-7000-454b-9d0c-7d45e752d916,Hardcoded DB Credentials,high,open,/app/backend/src/database/connection.ts,taskflow,The code hardcodes database credentials as fallbacks when environment variables are absent; creating a risk of credential exposure. This can lead to unauthorized access and subsequent security breaches. Secure practices require sensitive information to be externally managed and not embedded in source code.,The PostgreSQL connection configuration employs hardcoded default values for critical database connection parameters such as host; port; database name; user; and password. Storing these credentials in source code creates significant security risks as attackers could steal these secrets if they gain access to the source code; version control; or container images. This approach violates secure secret management principles by relying on static; easily extractable values; potentially leading to unauthorized access; privilege escalation; or data exfiltration.,5@@10,CWE-798,"8/8/2025, 6:19:13 PM",,False,The analysis confirms that fallback default credentials are present in code that is used for production database connections. The hardcoded values could lead to unauthorized access if environment variables are not set; which is a significant risk under CWE-798. The code is not isolated to tests or examples; rather; it is integral to the production application; meaning this vulnerability cannot be safely ignored.
e44df141-b41f-439a-b788-f2a6fe6d2cb5,Missing Ownership Checks,high,open,/app/backend/src/controllers/commentController.ts,taskflow,The endpoint retrieves a comment based solely on the provided comment ID and the authenticated user ID without validating whether the comment truly belongs to the requesting user. This opens up the risk of insecure direct object reference IDOR; where attackers can guess or enumerate comment IDs to access others' comments. The lack of explicit ownership verification significantly undermines the endpoint's security; highlighting the necessity to implement thorough ownership checks. Additionally; similar patterns observed in other endpoints suggest a systemic issue that must be addressed promptly.,The vulnerability arises because the endpoint fetches a comment using only the comment ID and the authenticated user ID without verifying the ownership of the comment. This oversight can allow an attacker to guess or enumerate comment IDs and retrieve comments belonging to other users; leading to an insecure direct object reference IDOR. The absence of explicit ownership verification in the controller; along with similar patterns in related endpoints such as updateComment; deleteComment; and getReplies; further emphasizes the inadequate validation of data ownership; making it a critical security concern.,64@@70,CWE-639,"8/8/2025, 6:19:12 PM",,False,The vulnerability is a true security risk because the code only verifies whether a user belongs to the project via project membership check rather than confirming if the comment is owned by the user attempting to access or modify it. In a collaborative team environment; while viewing comments may be allowed for any project member; actions like updating or deleting a comment should be restricted to the comment's owner to prevent potential misuse or unauthorized modifications. Therefore; the lack of robust ownership verification is a valid security concern; making this issue a true positive.
b9dac9d9-8ea5-4f56-b60c-d5b9bedd2076,Unrestricted Activation,high,open,/app/backend/src/controllers/userController.ts,taskflow,The endpoint allows any authenticated user to activate accounts without verifying proper authorization. This lack of control presents a significant security risk. It could enable attackers to regain access to compromised or deactivated accounts; leading to potential misuse.,The activateUser endpoint does not perform an authorization check; which is critical to prevent unauthorized reactivation of accounts. Any authenticated user can trigger this endpoint to reactivate user accounts; potentially allowing malicious actors to bypass account suspension or to compromise previously deactivated accounts. This vulnerability may lead to significant security risks; including boosted unauthorized access and account misuse.  In addition to the lack of authorization check; the implementation does not verify the caller's privileges which further compounds the risk. The endpoint merely validates the presence of a user ID; assuming that the user invoking the endpoint is permitted to perform this action. Consequently; this can be exploited by attackers seeking to reverse account lockouts or suspensions; highlighting a severe risk in the account management workflow.,95@@107,CWE-284,"8/8/2025, 6:19:08 PM",,False,The vulnerability in the activateUser endpoint is a valid issue because it lacks an authorization check. Although id existence is validated; the absence of further privilege verification allows any authenticated user to potentially reactivate accounts; which can lead to unauthorized access. This endpoint is part of the main production code for a team task management application; further highlighting the severity and non-false positive nature of the vulnerability.
71f8c71e-f384-47b0-92c8-0fab8945b1ae,Unbounded Pagination Offset,low,open,/app/backend/src/controllers/userController.ts,taskflow,The code allows an unbounded offset value for pagination; which can be exploited to cause high resource usage or even a denial-of-service condition. Without proper limits; clients can request very large offsets; leading to inefficient database queries and excessive memory use. It is recommended to enforce a maximum bound on the offset parameter to mitigate these risks.,The issue arises from the fact that the offset parameter is not bounded; which allows clients to specify extremely large offsets. This can result in excessive database scanning; high memory consumption; and ultimately lead to denial-of-service conditions if the database or application resources are exhausted. It is important to validate and limit input parameters to prevent potential abuse which could degrade service performance and availability.,6@@20,CWE-400,"8/8/2025, 6:19:08 PM",,False,The vulnerability in question arises from the unbounded offset parameter in the getAllUsers endpoint. This parameter; taken directly from user input without an upper bound; could be exploited to stress the underlying database by producing expensive queries via excessively large offset values. Considering that this endpoint is part of production code in the TaskFlow platform; it ensures that the vulnerability is applicable and cannot be safely ignored despite its low severity rating.
4c2fb2f6-5ff9-4f0b-b69e-de5141ade0d9,Unrestricted Deactivation,high,open,/app/backend/src/controllers/userController.ts,taskflow,The absence of proper administrative checks allows any authenticated user to deactivate accounts; leading to potential abuse and denial-of-service. The function only prevents self-deactivation; bypassing the necessary role validation. This critical oversight emphasizes the need for robust permission checks to prevent unauthorized access to sensitive user operations.,The reported vulnerability in the deactivateUser endpoint highlights the absence of an essential administrative privilege check; which allows any authenticated user to deactivate any other user account. This creates a significant security risk as it permits unauthorized account management operations and can lead to a denial-of-service scenario where malicious users deactivate accounts at scale. The lack of an admin check means that the function does not verify if the initiating user holds the required administrative privileges before proceeding with the deactivation operation.  Additionally; the issue is further compounded by the minimal validations in the logic; as the function only checks to prevent self-deactivation; ignoring the broader risk of abuse by non-admin users. This oversight makes the application vulnerable to exploitation; potentially allowing attackers to disrupt service availability and compromise the trust of the user base. It is critical that administrative permissions be validated to ensure that only authorized personnel can perform sensitive operations like account deactivation.,77@@93,CWE-284,"8/8/2025, 6:19:08 PM",,False,The vulnerability is not a false positive. The deactivateUser endpoint lacks a proper administrative privileges check; allowing any authenticated user to deactivate other users' accounts if they are not deactivating their own. This creates a serious security risk in a production environment; and given the context and the lack of complementary safeguards; this vulnerability should be addressed immediately.
6498a61d-c0c4-4288-a69a-2d109eca16fe,Unrestricted Role Update,high,open,/app/backend/src/controllers/userController.ts,taskflow,The code fails to verify that the user attempting a role update possesses the required permissions; allowing for unrestricted role modifications. This opens up a critical risk by enabling attackers to grant themselves elevated privileges. Without appropriate checks; the system is vulnerable to privilege escalation and possible full system compromise.,The vulnerability exists because the endpoint updateUserRole does not incorporate any checks to validate the privileges of the calling user. This omission allows any authenticated user to change roles; including potentially assigning administrative or managerial privileges. Without proper role-based access control; attackers could escalate privileges leading to significant security breaches; thus violating the principle of least privilege and compromising the entire access control scheme.,57@@74,CWE-284,"8/8/2025, 6:19:08 PM",,False,The updateUserRole endpoint does not verify that the authenticated user has sufficient privileges to modify another user's role. While it restricts the possible roles to a fixed set; it does not enforce that only authorized users; such as administrators; are allowed to make this change. In the context of a full-stack production application; this flaw poses a real risk of privilege escalation; making it a true vulnerability and not a false positive.
c2080a3c-0316-436d-967a-6ce4b8f0f0f6,Unrestricted Role Assignment,high,open,/app/backend/src/controllers/authController.ts,taskflow,The vulnerability stems from the acceptance of client-supplied roles during registration without proper validation; enabling privilege escalation. This issue is critical as it allows malicious users to bypass access controls and potentially gain admin-level permissions. Proper server-side authorization is missing; making the endpoint susceptible to significant security breaches.,This issue arises because the registration endpoint directly incorporates client-supplied role information into the payload; without performing any server-side checks to validate the role. As a consequence; a malicious user can provide roles such as 'admin' or 'superuser' in an attempt to elevate privileges; resulting in a security breach.  Furthermore; lack of server-side authorization controls signifies that user-controlled data governs critical access rights. Such misconfigurations facilitate privilege escalation attacks; where attackers could potentially compromise the system by bypassing the implemented roles and permissions; leading to unauthorized access or actions within the application.,18@@24,CWE-285,"8/8/2025, 5:56:36 PM",,False,The vulnerability identified is not a false positive. The registration endpoint directly includes the client-supplied role without any validation or sanitization; making it susceptible to privilege escalation attacks if an attacker supplies an elevated role. Given that this code is part of the production authentication flow and resides in an authentication-controlled directory; the risk is high. The lack of server-side authorization checks confirms that this is a true security issue that should be addressed.
1e7cbe0b-53cc-4f1d-92e9-ab4dc839ae5e,Plaintext Password Log,medium,open,/app/backend/src/controllers/authController.ts,taskflow,Logging the entire request body; including passwords; exposes sensitive credentials. This not only violates confidentiality principles but also makes it easier for attackers to extract and misuse the data from logs. Ensuring that sensitive data is handled properly and not logged helps reduce the risk of unauthorized access and other credential-based attacks.,The issue arises from logging the entire request body using JSON.stringify; which includes sensitive information such as the user's password. This is a major security risk; as storing plaintext passwords in logs can lead to unauthorized credential access if the logs are breached. Sensitive data logged in plaintext violates best practices and could be used for subsequent attacks including credential theft or unauthorized access.  Logging sensitive credentials exposes risks not only through accidental data leaks but also by providing an attractive target for attackers who can access aggregated logs over time. The diverse storage and access of logs across multiple systems further increases the risk of unauthorized exposure; making this practice unsafe and non-compliant with security standards.,44@@46,"CWE-532, CWE-200","8/8/2025, 5:56:36 PM",,False,The investigation confirmed that the vulnerability arises from logging the entire request body in the login function; which inadvertently logs sensitive information such as user passwords. This is a genuine issue because it can lead to unauthorized access if log files are compromised. Given that this is part of production authentication logic in a full-stack; real-time team management application; the vulnerability must be addressed; and therefore it is not a false positive.
7550cbc7-1651-45ea-9e7d-68551ac0d21f,Password Reset Flaw,high,open,/app/backend/src/controllers/authController.ts,taskflow,The logic in password reset is flawed since it changes the password before validating the reset token. This flaw can allow attackers to change user passwords without proper token validation. The vulnerability poses a high risk as it bypasses the necessary authentication step.,The vulnerability stems from an ordering flaw in the password reset process. In the given code; the user's password is changed through AuthService.forceChangePassword before the reset token is validated via AuthService.validateResetToken. This sequence of operations means that even if token validation fails later; the password has already been updated; which can allow unauthorized changes. Such a flow bypasses the intended security checks and undermines the authentication process; making it a severe vulnerability that could be exploited to compromise user accounts.,108@@112,CWE-640,"8/8/2025, 5:56:36 PM",,False,The password reset process exhibits a critical ordering flaw where the password is changed before the reset token is validated; thus allowing potential attackers to bypass the intended security checks. Given that this code is located in a production authentication controller for a team management platform; the vulnerability poses a severe risk and should not be considered a false positive.
bf82da3d-be2c-403e-ac7b-ae7ae4770453,Unchecked Meeting Content,high,open,/app/backend/src/controllers/aiController.ts,taskflow,The code fails to sanitize the meeting content before processing it with the AI service. It merely checks the length and type; which is insufficient to prevent prompt injection and other malicious payloads. This oversight could allow an attacker to execute harmful actions; leading to potential data breaches and unauthorized behavior.,This vulnerability arises because the generateMeetingNotes endpoint only performs basic type and length validations on the meeting content without thoroughly sanitizing or filtering the data. As a result; an attacker can supply maliciously crafted input that may include hidden trigger tokens or harmful instructions. This unvalidated input is then directly sent to an AI service; potentially leading to prompt injection; data leakage; or unauthorized operations. The lack of robust input validation confirms that the code is susceptible to various security risks associated with untrusted content; making it a serious issue; especially in sensitive meeting contexts.,114@@128,CWE-20,"8/8/2025, 5:56:16 PM",,False,The vulnerability in the generateMeetingNotes endpoint is legitimate; as it fails to sanitize the 'content' input beyond basic type and length checks. This could allow an attacker to inject harmful content into the AI prompt; potentially leading to prompt injection or other security issues. Given that this code is part of the production system of TaskFlow; a full-stack team task management platform; the risk is both applicable and significant.
28c757be-ed02-4a07-90ba-6e2b504fa634,Prompt Injection via Chat Messages,high,open,/app/backend/src/controllers/aiController.ts,taskflow,This vulnerability arises from passing unchecked user-supplied chat messages directly to an AI service. Due to minimal validation and lack of sanitization; attackers can inject malicious content; leading to potential prompt injection attacks. The behavior could allow the manipulation of the AI model; exposing sensitive data or bypassing security protocols.,This code block is vulnerable to prompt injection because it passes user-controlled chat messages directly to an AI service with minimal validation. The only checks in place involve verifying that the messages array is non-empty; that each element contains the required fields role and content; and that the role belongs to a limited set of valid values. There is no sanitization or strict constraint on the actual content of the messages; which allows an attacker to inject malicious content that could manipulate the AI's response or behavior. As a result; attackers might be able to bypass security policies; extract sensitive information; or manipulate the output of the AI service; creating significant security risks including confidentiality and integrity violations.,13@@28,CWE-20,"8/8/2025, 5:56:16 PM",,False,The code receives user-controlled messages with only minimal validation ensuring each message has a valid role and content and subsequently passes them without sanitization to the AI service. This creates a plausible prompt injection vulnerability; which is particularly concerning in a production environment like TaskFlow. Given the exposure of the endpoint and the lack of sanitization; this vulnerability should be considered real rather than a false positive.
