ID,Name,Severity,Status,Location,Branch,Message,Description,Line Span,CWE,Created Date,Closed Date,False Positive,False Positive Explanation
88285e34-e907-4a10-a7a7-2d793053719e,Credential Leak,high,open,/app/backend/src/utils/ai-integration.ts,taskflow,The API key is transmitted to an external endpoint without proper safeguards; making it vulnerable to interception. This design flaw could allow an attacker to steal the key and misuse it; causing unauthorized access and significant financial or security implications. The vulnerability is critical since it impacts the security of sensitive credentials that should remain confidential.,The function exposes the OpenAI API key by including it in the request payload sent to a third-party endpoint. This presents a critical vulnerability because the key is sensitive and control over which third party will receive this key is lost; leading to unauthorized API usage; potential billing issues; and credential compromise if intercepted. The issue is heightened by the fact that even though the value is dynamically retrieved from the environment; its transmission to an external service without proper validation or encryption effectively mirrors hard-coded secret exposures.,1@@5,CWE-798,"8/8/2025, 6:29:20 PM",,False,The vulnerability is real. The function sends a sensitive API key from environment variables to an external third-party URL without any form of validation or assurance that the endpoint is trusted. Given that the URL is parameterized and there are no safeguards; an attacker who can influence the URL could intercept the key. This; compounded with the fact that the file is part of the production utility code; indicates that attention is needed to secure this data transmission.
c82f59a4-df65-4216-9404-04447ffc24e0,SSRF via fetch,high,open,/app/backend/src/utils/ai-integration.ts,taskflow,This issue arises due to an unvalidated URL parameter allowing an attacker to perform SSRF. The function is vulnerable because it forwards a caller-controlled URL without checks; enabling potential internal data exposure and bypassing network security measures. The lack of validation exposes the server to potential enumeration and unauthorized access to internal systems.,The function makes an external HTTP request using a caller-controlled URL without any validation such as a whitelist; scheme check; or proper sanitization. As a result; an attacker can craft a URL pointing to internal services e.g. metadata endpoints for internal cloud infrastructure that might be accessible even behind network restrictions. This behavior satisfies the classic definition of a Server Side Request Forgery SSRF vulnerability; whereby the attacker can potentially enumerate internal resources; bypass firewall restrictions; and deliver data exfiltration attacks.  Because the function directly forwards the input without additional verification; it is possible for an adversary to use the function in unwanted ways. Such misuse can allow bypassing of network constraints; exposure of sensitive internal endpoints; and can lead to further compromise of the server environment. Thus; the issue is significant; as it might lead to severe impacts in multi-tenant; cloud-hosted; or otherwise sensitive server environments.,1@@5,CWE-918,"8/8/2025, 6:29:20 PM",,False,The analysis of the source code shows that the function sendToThirdParty accepts an unvalidated URL parameter; which is directly used in an HTTP request with fetch. This use in production utility code exposes the application to SSRF attacks; where an attacker can craft a malicious URL to target internal services. Given the file’s context in core production utilities and the absence of any additional sanitization or validation measures; this vulnerability is genuine and should be addressed.
0cab7216-1939-4743-a85d-74d258931b12,Eval Injection via Function Constructor,critical,open,/app/backend/src/services/searchService.ts,taskflow,The issue uses the JavaScript Function constructor with unsanitized user input; allowing an attacker to inject and execute arbitrary code. This results in a high risk of remote code execution. The vulnerability is severe due to the direct impact it has on system integrity and data security.,The vulnerability is caused by the unsafe use of the JavaScript Function constructor to execute an input string. Because user input directly influences the code to be compiled and executed; an attacker can inject arbitrary code into the application. This type of vulnerability enables remote code execution; allowing an attacker to execute malicious code that could compromise data; break security boundaries; or modify sensitive information.  The risk is elevated due to the lack of input validation and sanitization. This issue is critical because it provides a direct path for an attacker to manipulate the server's behavior; including accessing environment variables; modifying the data layer; or executing unintended functions. The combination of CWE-95 and CWE-94 indicates that the vulnerability triggers both command injection and unsafe dynamic code execution; making it a severe security concern that must be addressed immediately.,5@@5,"CWE-95, CWE-94","8/8/2025, 6:26:57 PM",,False,The filterTasks function unsafely transforms user-supplied input into executable code via the Function constructor without any sanitization. This results in a valid remote code injection vulnerability; particularly in a production code context; making it a real and exploitable vulnerability rather than a false positive. The evidence from the code and its operational context confirms this assessment.
49070f7c-0672-460e-9fff-fec12beb0f64,Unvalidated Role Assignment,high,open,/app/backend/src/services/authService.ts,taskflow,The issue permits user-controlled role assignment; enabling privilege escalation with no server‑side validation. The lack of restriction or input sanitization allows unauthorized access. This flaw critically undermines proper access control mechanisms; posing significant security risks.,The RegisterData interface allows the caller to provide a role value directly; which can include high-privilege roles such as 'admin'. This unvalidated input is directly passed to UserModel.create without any server‑side restrictions; creating a scenario where an attacker could exploit this behavior to assign themselves administrative privileges. This vulnerability exposes the application to privilege escalation risks and undermines access control measures. The absence of proper validation or restrictions on role assignment leads to a breakdown in system security; making it easier for unauthorized users to gain elevated access.,14@@20,CWE-284,"8/8/2025, 6:26:46 PM",,False,The vulnerability is not a false positive because the role value is accepted directly from user input without any validation; allowing potential privilege escalation by assigning high-privilege roles. The code is part of the production authentication service; and the unvalidated role directly affects user creation. Therefore; this constitutes a significant security flaw that cannot be safely ignored.
51ae6f31-cfd1-4bc9-8f44-3def8312a73c,Weak Password Check,medium,open,/app/backend/src/services/authService.ts,taskflow,The password validation code checks if the password length is below a minimum requirement but does not take any action when the condition is true. This results in weak passwords being accepted; thus exposing the system to risk. It is imperative to implement proper handling in this check to enforce security policies and mitigate the risk of attack.,This issue represents a failure in proper password policy enforcement. The password length check is present; but because the block is empty; no corrective action is taken when the password is too short. This omission allows the system to accept weak passwords; including empty ones; which significantly increases the potential for successful brute-force or credential-stuffing attacks. Furthermore; failing to enforce strong password policies can lead to broader security vulnerabilities within the system; ultimately undermining the overall authentication mechanism.,29@@30,CWE-521,"8/8/2025, 6:26:46 PM",,False,The vulnerability in the weak password check is genuine because the code intends to enforce a minimum password length but fails to handle weak passwords due to an empty conditional block. This flaw allows weak passwords to be accepted during user registration; which may lead to security issues such as brute-force attacks. The file is part of production authentication logic; and no other mitigations exist to counter this issue.
f195b28d-d5c8-40c1-91ae-6687199e2a09,Unvalidated Feature Input,medium,open,/app/backend/src/routes/ml.ts,taskflow,User-controlled input is passed directly to the prediction function without any validation; which can cause unintended behavior in the system; including crashes and exploitation risks. This vulnerability may lead to malformed inputs and potential denial-of-service via resource exhaustion. The lack of validation opens the application to model poisoning and manipulation.,The endpoint accepts user-controlled JSON payload and directly passes it to the predict function without performing any form of schema validation; type checking; or range enforcement. This lack of input validation can allow an attacker to send malformed or malicious data; leading to potential crashes; incorrect model behavior; or even exploitation in machine learning inference pipelines. As no restrictions are enforced on the input; it creates a vulnerability where adversaries could inject unexpected value types or exceedingly large inputs; leading to possible denial-of-service or model poisoning scenarios.,8@@8,CWE-20,"8/8/2025, 6:25:43 PM",,False,The analysis confirms that unvalidated user input is directly passed to the predict function via the POST /predict endpoint without any validation. This could lead to downstream risks; such as denial-of-service or model poisoning; especially if the underlying machine learning component becomes more complex in production. Therefore; this vulnerability cannot be safely ignored and is not a false positive.
f39e58b3-48eb-401b-b469-c1880a643f90,Unsafe AI Code Execution,critical,open,/app/backend/src/routes/ai.ts,taskflow,This vulnerability occurs when AI-generated code is directly executed using the JavaScript Function constructor without any validation. As a result; an attacker might manipulate the code output to execute malicious actions on the server. The inherent trust in the AI response without proper security measures could lead to a complete server compromise; making this an extremely severe issue.,The vulnerability exists because the route processes requests by accepting AI-generated content and subsequently executing it as JavaScript code using the Function constructor. This execution flow lacks any validation or sandboxing; allowing a malicious actor to inject and execute arbitrary code. Such an attack could lead to compromising the entire Node.js process; resulting in complete system takeover; data exfiltration; and lateral movement within the server environment.  In addition; this design exposes the server to risks of remote code execution; making it an extremely serious security flaw. Attackers can craft requests that manipulate the AI system to produce harmful scripts; thus bypassing intended execution flows and security boundaries. The risk is compounded by the fact that the execution context carries the full privileges of the Node.js process; further exacerbating the potential fallout of an exploitation.,22@@28,CWE-94,"8/8/2025, 6:24:15 PM",,False,The vulnerability is legitimate because the code dynamically executes unvalidated AI-generated content using the JavaScript Function constructor. This execution flow can lead to remote code execution and compromise the server; and the endpoint is part of the production code rather than a test or utility module. Authentication is not sufficient to prevent exploitation of this vulnerability; so it should be taken seriously.
9196554c-9693-45d2-bac2-60474fd8ec85,Unsafe AI Command Execution,critical,open,/app/backend/src/routes/ai.ts,taskflow,The issue is critical because it allows execution of arbitrary OS commands based on AI output. It creates a high risk of system compromise due to unvalidated input execution. This vulnerability in command execution from AI service responses must be addressed immediately.,This endpoint exposes a critical vulnerability by executing commands received as AI-generated text without any sanitization or validation. The response from the AI service; which comes from untrusted input; is split into commands and each command is executed using childprocess.exec; allowing for arbitrary command execution. If an attacker manipulates the AI output; they can inject malicious commands that execute on the server; which poses a significant risk of remote code execution and complete system compromise.  Furthermore; the code does not implement any mechanisms for command validation; whitelisting; or argument escaping; essentially relying on the assumption that the AI will not be misled into outputting commands that could be harmful. This negligence significantly increases the risk of severe security breaches; making this vulnerability urgent and critical for remediation. It is recommended to implement strict input validation and command sanitization to mitigate this high-severity risk.,37@@43,CWE-78,"8/8/2025, 6:24:15 PM",,False,The insecure use of childprocess.exec on unvalidated AI-generated input in the '/execute-commands' endpoint represents a real vulnerability. The input data is not sanitized; enabling arbitrary command execution; and this endpoint appears to be part of the production code base. The absence of validation measures and the potential for remote code execution confirm that this vulnerability is not a false positive and requires prompt remediation.
07932579-ddb8-4c0d-98d5-d22353d7c6d9,Path Traversal,high,open,/app/backend/src/routes/files.ts,taskflow,The vulnerability is caused by the direct concatenation of user input into a file path without any validation or canonicalization. This enables attackers to perform path traversal by injecting directory traversal characters; thereby accessing sensitive files outside the intended directory. The lack of proper sanitization and whitelist checks means that the issue poses a significant risk to system security; making it a high severity concern that needs immediate remediation.,The code builds a file path by combining the current working directory with a static 'uploads' folder and a user-supplied filename without proper sanitization or validation. This logic does not neutralize directory traversal characters such as '..'; which an attacker can exploit to access arbitrary files on the system. As a result; an attacker with authenticated privileges could potentially read sensitive files; such as system configuration files or other restricted resources.   Furthermore; the absence of measures such as canonicalization of paths or a whitelist of allowed filenames exacerbates the risk. This kind of vulnerability can lead to unauthorized file access; impacting the integrity and confidentiality of the system; especially if the Node.js process runs with elevated privileges. It demonstrates a failure to enforce strict input validation on file paths; making it a critical security oversight.,31@@34,CWE-22,"8/8/2025, 6:24:08 PM",,False,The vulnerability stems from the direct concatenation of user-supplied input into a file path without proper sanitization. The file is served through an inline handler in production routing code; making it exploitable by authenticated users who can perform directory traversal. Given the context; lack of input validation measures; and the role of this code in a production environment; the issue is valid and must be addressed.
9f75a29d-4211-4171-8c84-4b676eb67ebe,MIME Type Spoofing,medium,open,/app/backend/src/middleware/upload.ts,taskflow,The file upload filter performs validation exclusively based on the MIME type; which can be easily spoofed by an attacker. This oversight allows for the possibility of malicious files being uploaded and executed; posing a serious security risk. The lack of comprehensive validation increases the attack surface; and additional file inspection measures are required. It is essential to implement further controls to ensure that the file's actual content matches its declared MIME type.,The vulnerability arises because the file upload filter solely relies on the MIME type provided by the client; which can easily be manipulated by an attacker to bypass security checks. Without proper verification of the actual file content or utilizing additional file validation techniques; this approach leaves the system vulnerable to malicious file uploads that might contain executable scripts or payloads. Such files; once processed or served; could result in significant security issues; including remote code execution or unauthorized data access. As a result; this issue should be treated with caution and addressed to incorporate more robust file verification mechanisms.,20@@43,CWE-434,"8/8/2025, 6:22:55 PM",,False,The vulnerability is genuine. The file upload middleware uses only the MIME type provided by the client without proper validation of file contents; which makes it susceptible to MIME type spoofing. This could allow an attacker to upload dangerous files; leading to possible remote code execution or data breach. As this middleware appears to be used in production within TaskFlow; it poses a real risk and should be addressed.
11bf91b1-dd5a-42ea-be99-99632186a97a,Log Injection Issue,medium,open,/app/backend/src/middleware/logging.ts,taskflow,User-controlled data is directly logged without sanitization. This can allow attackers to inject control characters to break log formats; potentially leading to log injection attacks and leakage of sensitive information. Properly sanitizing and encoding log entries is necessary to protect against these vulnerabilities.,The vulnerability arises from direct logging of client-controlled data without proper sanitization or validation. This can permit an adversary to inject control characters such as newline \n or carriage return \r into log entries; effectively breaking the intended logging structure. The issue not only opens the door for log forgery and injection but also risks exposing confidential data; as sensitive query parameters may be logged. Mitigation requires careful sanitization and encoding of data before logging; reducing the risk of log injection and inadvertent data disclosure.,11@@18,CWE-117,"8/8/2025, 6:22:29 PM",,False,The loggingMiddleware function takes untrusted; client-controlled data and logs it without performing sanitization. This can allow attackers to inject control characters that may corrupt log entries; potentially impacting log integrity and exposing sensitive data. Given the file's production context in the TaskFlow platform; this vulnerability is exploitable and should not be considered a false positive.
2043067d-540a-4365-bf15-3f5d615e500d,Sensitive Data Logging,low,open,/app/backend/src/middleware/logging.ts,taskflow,The logging mechanism directly writes request-specific data including the full URL and User-Agent header to logs without redaction; potentially exposing sensitive data. This may include secrets like session ids; tokens; or other sensitive query parameters; thereby creating a risk of leaking critical information. Corrective measures include redacting sensitive components and implementing log-scrubbing to mask or remove sensitive data before persistence.,The issue stems from recording the complete request URL and the User‑Agent header in the logs without any sanitization or redaction. This logging practice can inadvertently capture sensitive details such as authentication tokens; session identifiers; or personally identifiable information if these are provided as query parameters. The logs serve as a repository of this information which can be accessed by unauthorized key holders or exploited by attackers to perform replay or credential harvesting attacks.  To address this; it is recommended to log only the essential components of the request; such as the path rather than the full URL; and to apply redaction or hashing on sensitive query parameters. Additionally; headers known to contain sensitive information; like Authorization or Cookie headers; should be excluded or masked; and a log‐scrubbing process should be implemented to ensure that sensitive patterns are sanitized before being recorded.,11@@18,CWE-532,"8/8/2025, 6:22:29 PM",,False,The middleware logs unsanitized request data including the full URL and User-Agent without checking for sensitive query parameters. This design exposes user-supplied data that may contain sensitive details. In production; this poses a genuine; albeit low-severity; security risk that should be mitigated through proper redaction; making it not a false positive.
446f43ed-ef70-49c7-ba3f-387182be3325,Trusting JWT Role Claim,high,open,/app/backend/src/middleware/auth.ts,taskflow,The JWT payload is client controlled and is directly used for authorization; allowing attackers to inject fabricated roles and escalate privileges if token integrity is compromised. This results in severe potential abuse since it bypasses traditional server-side checks. The issue necessitates a re-design of the authentication flow to include proper verification of user roles.,The middleware incorrectly trusts the JWT's role claim provided in the token to authorize access. Since the JWT payload is client-controlled; an attacker could manipulate or forge the token by obtaining the secret key; exploiting a weak signing algorithm; or leveraging a token substitution attack to inject an elevated privilege such as 'admin'. This bypasses the actual server-side enforcement of user permissions; resulting in unauthorized access and privilege escalation risks.  Given that the token verification only checks if the token is structurally valid without re-checking the user's true permissions; the vulnerability poses a significant risk by allowing potentially malicious actors to escalate privileges if they manage to manipulate the token. This issue requires a more robust server-side verification mechanism to validate the user's role and permissions.,23@@30,CWE-284,"8/8/2025, 6:21:19 PM",,False,The vulnerability is real because verifyAccessToken merely decodes the JWT without verifying its signature; leaving the role claim untrusted and potentially manipulated by an attacker. This could lead to unauthorized privilege escalation; especially in a production authentication context. The code is not protected by any additional server-side checks for user roles; therefore the issue should not be ignored.
5638c362-4759-46ba-97e4-e8cc3008cac4,Unsafe Body Logging,high,open,/app/backend/src/middleware/audit.ts,taskflow,The audit middleware logs complete unsanitized request bodies for non-GET requests; risking exposure of sensitive information. This logging behavior can be manipulated for log injection; potentially corrupting log files and undermining analysis tools. The lack of sanitization results in compliance breaches and expands the attack surface; necessitating prompt remediation.,The middleware logs the full request body for every non-GET request without performing any sanitization or redaction; which leads to potential exposure of sensitive data such as passwords; tokens; or personal information in the logs. Log files are often accessible by various parties and are less secured than the main application data store; increasing the risk of sensitive data leakage.  Additionally; because the request body is stored verbatim in the logs; attackers can exploit this behavior to inject malicious log entries or embed control characters; thereby corrupting the log files. This could lead to further manipulation in downstream log analysis and monitoring tools; ultimately compromising the integrity and security of the logging infrastructure. Overall; the issue violates best practices by failing to enforce data minimization and invalidates the data confidentiality principles; making the application more susceptible to exploitation.,20@@24,"CWE-532, CWE-117","8/8/2025, 6:21:09 PM",,False,The middleware logs unsanitized request bodies with no input validation or sanitization; directly exposing sensitive user data and potentially enabling log injection attacks. The file is part of the production codebase; and there is no mitigating logic in place. Thus; the risk is real and the vulnerability must be addressed.
